學群,簡要介紹,學習內容,主要學類,多元能力,性格特質
文史哲 學群,文史哲學群主要以人類發展的思想、軌跡、符號為探究對象，依據人類發展的思想、軌跡、符號等建構人類的樣貌，並且進行區域、文化、時代間的橫向與縱向比較，文學主要培養探究及欣賞文化、運用語文及創作、賞析的能力；史學在瞭解歷史現象的演進、分析、探究與考據；哲學在訓練思考能力以對自我及世界反省。,文史學類的大學主要課程包括：瞭解中國歷代文學作品及思想、瞭解中外文化思想的演變、瞭解政治或社會制度與歷史發展的關係、並學習鑒賞歷史文物及搜集、整理地方歷史文獻。哲學學類主要要學習中外哲學史、要瞭解歷代哲學家的思想與影響、瞭解人類對宇宙及世界的觀念、瞭解法律及社會制度設計的原因、假設及社會正義的意義與內涵。課程還包括了研究人的意志是否自由、倫理道德的本質和必要性、探討知識的本質和來源、宗教的本質及心靈和物質的關係。,"['圖書資訊', '文化產業', '中國語文', '歷史', '哲學', '台灣語文', '史地', '宗教', '華語文教育', '文史哲跨學類']","{'語文理解與表達': '能透過語文理解他人想法形成特定概念，且能說明特定想法或因果關係。', '批判思考': '運用不同觀點對問題進行理性分析，對問題的解決方法或結論，評估出優缺點、支持、反對的意見。', '主動學習': '積極尋求新資訊用以掌握問題的前因、後果以及預期影響，並依據各環節選擇適合的學習行為。', '敏銳創造': '能覺察特定事件與觀念、理論之間的差異，且能對事物進行拆解、組合、重新詮釋，呈現新穎之處。', '邏輯推理': '能捕捉事物運作的規律或關聯性，歸納或是推演不同事物的差異或因果關係，並得到特定理解。', '問題解決': '分析並預判問題的成因與後果，設想出合適的解決方法及使用的工具。'}","{'主動積極': '常常主動提出特定見解，樂於付出活力與熱情投入特定問題、活動，引領他人的行動。', '變通開創': '常常對多種事物，表達熱情興趣，對於既有事物，進行拆解、重組，給予新的理解與觀點，並且喜愛創造出令人意想不到的新事物。', '合作互助': '總是願意優先關照、包容他人的需求，在不同意見中尋求最大的合作可能，優先尋求團體的共同價值，信任團體成員的指引。'}"
教育 學群,教育學群依據教育原理與對象需求，探究人類對象的教育目標與教育實務方法，並且比較機構間、區域間的教育特性差異，提供各層級、各領域之教師有效的訓練原理與技術。,教育學群主要培養中小學及幼兒教育師資，除各學科領域專業知識外，還要學習教育理論的學習、課程與教材的設計、教學方法、教師應具備的素養等。,"['數位學習', '科技教育', '華語文教育', '教育', '特殊教育', '幼兒教育', '成人教育', '數學教育', '社科教育', '英語教育']","{'語文理解與表達': '能透過語文理解他人想法形成特定概念，且能說明特定想法或因果關係。', '主動學習': '積極尋求新資訊用以掌握問題的前因、後果以及預期影響，並依據各環節選擇適合的學習行為。', '問題解決': '分析並預判問題的成因與後果，設想出合適的解決方法及使用的工具。', '批判思考': '運用不同觀點對問題進行理性分析，對問題的解決方法或結論，評估出優缺點、支持、反對的意見。', '自省促進': '收集、評估自己或他人的表現，提出可改善及調整的方法或採取行動。', '社會覺察與合作': '覺察並理解他人的感受或想法，並調整自己的做法，配合他人來完成任務。'}","{'主動積極': '常常主動提出特定見解，樂於付出活力與熱情投入特定問題、活動，引領他人的行動。', '合作互助': '總是願意優先關照、包容他人的需求，在不同意見中尋求最大的合作可能，優先尋求團體的共同價值，信任團體成員的指引。', '樂群敬業': '總是表現活潑、傳遞熱情，主動參與活動，樂衷於與夥伴一同完成任務。'}"
法政 學群,法政學群主要探究人類社會運作中相關法律、政治制度的各項層面，包括瞭解法律、政治運作的過程及政治理論的建構，藉以訓練從事法案制定、社會改革之專業人員。,法律主要的課程是要學習及比較我國和其他國家的憲法基本架構內容與法律、認識各種法律下的權力與義務關係、學習民事及刑事案件訴訟程序、財產有關的法律、刑法有關之法律、國際貿易法規及智慧財產權法規等。政治主要課程包括：學習我國政治制度的變遷、政府預算的決策與執行、瞭解各級政府行政的理論與方法、學習政治思想史及對政治思潮的影響、認識國家重要政策形成的過程、學習國際政治與組織以及民意調查的概念及方法等。,"['犯罪防治', '法律', '財經法律', '政治', '行政管理', '土地資產']","{'語文理解與表達': '能透過語文理解他人想法形成特定概念，且能說明特定想法或因果關係。', '批判思考': '運用不同觀點對問題進行理性分析，對問題的解決方法或結論，評估出優缺點、支持、反對的意見。', '邏輯推理': '能捕捉事物運作的規律或關聯性，歸納或是推演不同事物的差異或因果關係，並得到特定理解。', '問題解決': '分析並預判問題的成因與後果，設想出合適的解決方法及使用的工具。', '主動學習': '積極尋求新資訊用以掌握問題的前因、後果以及預期影響，並依據各環節選擇適合的學習行為。', '說服協商': '提出觀點與他人商議或說服他人同意，以積極的態度引導他人，達成共識、目標，或解決困難。'}","{'主動積極': '常常主動提出特定見解，樂於付出活力與熱情投入特定問題、活動，引領他人的行動。', '深思力行': '常常追求事物的條理秩序，審慎確認事物的彼此關係，行事仔細考量後果。', '合作互助': '總是願意優先關照、包容他人的需求，在不同意見中尋求最大的合作可能，優先尋求團體的共同價值，信任團體成員的指引。'}"
管理 學群,管理學群主要處理組織系統內外人事物的各種問題，學習從事溝通協調、領導規劃或系統分析、資源整合等，以促使組織或企業工作流程順暢、工作效率提升、工作環境人性化、合理化，以收最大效益。,管理相關學系的課程包括：瞭解企業組織與管理方法、國民就業市場的供需、學習品質管制的觀念與方法、如何有效的經營管理及激勵員工，學習資訊系統的統整規劃與管理、工廠生產作業程式、產品行銷方法及瞭解勞工問題及勞資關係等。,"['資訊管理', '工業管理', '醫務管理', '文化產業', '勞工關係', '行政管理', '企業管理', '行銷經營', '運輸物流', '土地資產', '觀光事業', '運動管理', '餐旅管理', '休閒管理', '國際企業', '管理跨學類']","{'語文理解與表達': '能透過語文理解他人想法形成特定概念，且能說明特定想法或因果關係。', '問題解決': '分析並預判問題的成因與後果，設想出合適的解決方法及使用的工具。', '主動學習': '積極尋求新資訊用以掌握問題的前因、後果以及預期影響，並依據各環節選擇適合的學習行為。', '批判思考': '運用不同觀點對問題進行理性分析，對問題的解決方法或結論，評估出優缺點、支持、反對的意見。', '邏輯推理': '能捕捉事物運作的規律或關聯性，歸納或是推演不同事物的差異或因果關係，並得到特定理解。', '說服協商': '提出觀點與他人商議或說服他人同意，以積極的態度引導他人，達成共識、目標，或解決困難。'}","{'主動積極': '常常主動提出特定見解，樂於付出活力與熱情投入特定問題、活動，引領他人的行動。', '合作互助': '總是願意優先關照、包容他人的需求，在不同意見中尋求最大的合作可能，優先尋求團體的共同價值，信任團體成員的指引。', '樂群敬業': '總是表現活潑、傳遞熱情，主動參與活動，樂衷於與夥伴一同完成任務。'}"
財經 學群,財經學群主要探究財務金融體制與系統運作機制，以資金為供給與需求探討金融體系的運作形式，可以提供對個人、組織、國家、國際等不同層面，在財務規劃與分析之原理概念，財務實務上的配置與管理技術。,包括資本市場、財務與會計規劃與分析、金融商品與實作、證券投資分析與配置、固定收益債券及資產管理等領域課程。,"['財金統計', '會計', '財務金融', '國際企業', '財稅', '保險', '經濟']","{'語文理解與表達': '能透過語文理解他人想法形成特定概念，且能說明特定想法或因果關係。', '邏輯推理': '能捕捉事物運作的規律或關聯性，歸納或是推演不同事物的差異或因果關係，並得到特定理解。', '問題解決': '分析並預判問題的成因與後果，設想出合適的解決方法及使用的工具。', '主動學習': '積極尋求新資訊用以掌握問題的前因、後果以及預期影響，並依據各環節選擇適合的學習行為。', '數理科學': '能選擇適當的科學、數理知識或邏輯來思考問題，依據科學規律正確地推演出答案或排列資訊。', '批判思考': '運用不同觀點對問題進行理性分析，對問題的解決方法或結論，評估出優缺點、支持、反對的意見。'}","{'主動積極': '常常主動提出特定見解，樂於付出活力與熱情投入特定問題、活動，引領他人的行動。', '堅毅負責': '常常長時間專注投入於特定事物，排除干擾訊息，會對所承諾的事物，會負起責任目標、執行到底，享受追求成就。', '合作互助': '總是願意優先關照、包容他人的需求，在不同意見中尋求最大的合作可能，優先尋求團體的共同價值，信任團體成員的指引。'}"
遊憩運動 學群,遊憩運動學群，以有助於人類身心理活動運作為核心的理論與實務規劃，包含了觀光休閒活動的投入與產出的規劃與管理，運動科學（運動生理、心理、生物力學等）理論與實務管理。,觀光休閒產業經營、觀光運輸與管理、運動科學管理（運動生理、心理、生物力學等）、運動技能之訓練。,"['運動保健', '體育', '舞蹈', '觀光事業', '運動管理', '餐旅管理', '休閒管理']","{'語文理解與表達': '能透過語文理解他人想法形成特定概念，且能說明特定想法或因果關係。', '肢體力量與協調': '能使肢體快速連續彎曲、伸展或扭轉，呈現力量與平衡，做出跳躍、衝刺、投擲動作。', '主動學習': '積極尋求新資訊用以掌握問題的前因、後果以及預期影響，並依據各環節選擇適合的學習行為。', '問題解決': '分析並預判問題的成因與後果，設想出合適的解決方法及使用的工具。', '社會覺察與合作': '覺察並理解他人的感受或想法，並調整自己的做法，配合他人來完成任務。', '專注力': '投入心力在特定訊息及排除外部干擾。'}","{'主動積極': '常常主動提出特定見解，樂於付出活力與熱情投入特定問題、活動，引領他人的行動。', '合作互助': '總是願意優先關照、包容他人的需求，在不同意見中尋求最大的合作可能，優先尋求團體的共同價值，信任團體成員的指引。', '樂群敬業': '總是表現活潑、傳遞熱情，主動參與活動，樂衷於與夥伴一同完成任務。'}"
跨領域 ,跨領域的設計乃是為了突破以往單一學科領域的限制，想要讓學生學習到跨領域的知識內涵，課程結構強調跨領域的自主規劃與學習，即可以人文與科學為核心的文理(Liberal art & Science)、專業(Profession)基礎學習課程，進階以跨領域實作為創新與批判實作，最後專精於特定領域的選擇。故此類別所涵蓋之知識屬性乃跨領域知識組成，非單一知識領域。由於跨領域屬性之學系或學程的學習內容涵蓋甚廣，因此在學類層級中的各項指標，如學習內容、主要學類、知識領域、興趣類型、核心素養、重要學科、加深加廣、多元能力、個人特質與生涯發展等差異甚大，建議您在了解各跨領域校系或學程之內涵時，以校系或學程為單位進行資料的查詢認識與比對，本系統亦無法提供上述項目於學類層級之資訊。,資料準備中,資料準備中,資料準備中,資料準備中
